{
  "schemaVersion": "1.0",
  "date": "2026-05-08",
  "school": "umelb",
  "summary": {
    "hookMain": "UMelb",
    "hookSub": "CSC 公派奖学金 + 新 VC 接棒",
    "hookSubHighlight": "新 VC 接棒",
    "subLines": [
      "CSC 联合奖学金最高 $120,000 · 名额有限速联导师",
      "Prof Carolyn Evans 5 月 4 日正式接任 UMelb 副校长",
      "国际生奖学金与中澳合作方向不变"
    ],
    "previewCards": [
      { "num": "01", "title": "UMelb-CSC 联合奖学金", "data": "最高 ~$120,000" },
      { "num": "02", "title": "新任副校长", "data": "5 月 4 日接任" }
    ]
  },
  "news": [
    {
      "idx": "01",
      "category": "奖学金",
      "h2Main": "UMelb-CSC 联合奖学金开放申请",
      "h2Sub": "国家公派 · PhD/研究型硕士 · 全免学费 + CSC 生活费",
      "h2Highlight": "全免学费",
      "lead": "墨尔本大学与中国国家留学基金委（CSC）联合奖学金 2026 年度名额正在接受申请，面向有意赴墨大攻读博士（PhD）或研究型硕士的中国国家公派留学生。<b>综合资助额度最高约 AUD $120,000</b>，是走国家公派路径读墨大性价比最高的方式之一。",
      "bullets": [
        { "k": "资助内容", "v": "墨大提供<b>全额学费豁免</b>（fee offset）；CSC 负责生活费及往返机票；总资助视学制（PhD 最长 3.5 年）最高约 $120,000 澳元" },
        { "k": "申请流程", "v": "①先联系墨大院系导师取得书面同意（Letter of Acceptance）→ ②通过 CSC 平台同步提交申报 → ③墨大奖学金办公室最终确认" },
        { "k": "热门方向", "v": "计算机科学 / 生物医学 / 商学 / 教育研究 / 环境科学，各院系名额独立分配，<b>越早联系导师，被接收的可能越高</b>" },
        { "k": "对你的影响", "v": "走公派路线读墨大，可绕开自费全额学费（研究生年均 $40,000–$55,000 澳元），是申请研究型学位最划算的组合，<b>名额每年有限，建议 5 月内先行联系导师</b>" }
      ],
      "source": "University of Melbourne · Graduate Research Scholarships",
      "sourceUrl": "https://scholarships.unimelb.edu.au/awards/graduate-research-scholarships"
    },
    {
      "idx": "02",
      "category": "校园动态",
      "h2Main": "Prof Carolyn Evans 接任 UMelb 新副校长",
      "h2Sub": "5 月 4 日正式上任 · 宪法与人权学者背景 · 延续国际合作方向",
      "h2Highlight": "新副校长",
      "lead": "2026 年 5 月 4 日，Prof Carolyn Evans 正式出任墨尔本大学副校长（Vice-Chancellor）。Evans 教授来自格里菲斯大学，是宪法与人权法领域知名学者，研究重点涵盖宗教自由与法律多元主义，<b>其全球合作与多元教育导向被国际学生群体视为积极信号</b>。",
      "bullets": [
        { "k": "背景", "v": "曾任格里菲斯大学副校长；研究领域：宗教自由、法律多元主义、宪法权利；<b>在多元文化教育议题上有深厚学术积累</b>" },
        { "k": "战略方向", "v": "Evans 公开表示希望强化墨大在全球的研究影响力与产业合作，与 UMelb 现行的国际生奖学金扩张、中澳科研合作布局方向一致" },
        { "k": "对国际生的影响", "v": "新任领导层延续墨大对国际学生友好政策，短期内不预期奖学金数量或录取标准发生重大变化" },
        { "k": "对你的影响", "v": "2026 年墨大高层交接平稳，有意向申请 2027 年入学的同学可按原计划推进，<b>不影响现行招生和奖学金政策</b>" }
      ],
      "source": "University of Melbourne · Newsroom · May 4 2026",
      "sourceUrl": "https://www.unimelb.edu.au/newsroom"
    }
  ],
  "quickview": {
    "titleMain": "今日 2 条",
    "titleHighlight": "一眼看完",
    "sub": "CSC 联合奖学金 2026 名额开放，最高约 $120,000 综合资助，名额有限须先联导师；新任副校长 Prof Carolyn Evans 5 月 4 日接棒，战略方向延续国际化布局。",
    "items": [
      { "n": "01", "title": "UMelb-CSC 联合奖学金", "body": "全额学费豁免 + CSC 生活费，综合最高约 $120,000；须先取得导师 LoA，再通过 CSC 平台申报；名额有限，5 月内联系" },
      { "n": "02", "title": "新任副校长接棒", "body": "Prof Carolyn Evans 5 月 4 日正式上任；宪法与人权法背景；延续 UMelb 国际合作与奖学金扩张方向，短期政策不变" }
    ],
    "cta": {
      "big": "关注每日大学日报",
      "sub": "10 所澳洲大学 · 奖学金 + 招生 + 校园动态一手同步",
      "badge": "05 / 08"
    }
  },
  "xhsCopy": {
    "p1": {
      "title": "墨大 5-08 两条硬料📣",
      "body": "在准备申请墨大的过程中，5 月 8 日有两条更新值得单独拎出来说。\n\n01 / CSC 联合奖学金——墨尔本大学和中国国家留学基金委的联合奖学金 2026 年度名额正在开放申请。走公派路线的话，墨大这边全免学费，CSC 那边管生活费和机票，综合下来最高能到约 $120,000 澳元。听起来很美但关键是名额有限，而且申请前必须先拿到导师的书面同意，所以越早联系院系导师越好。\n\n02 / 新副校长上任——Prof Carolyn Evans 5 月 4 日正式接任墨大副校长。她来自格里菲斯，是宪法和人权法学者，之前一直在推国际化合作和多元教育。对我们国际生来说，短期内政策不会有大变，奖学金和招生方向延续。\n\n准备申请墨大 PhD 或研究型硕士的姐妹，CSC 这条线值得认真看一下，评论区扣 1 我可以分享申请流程🙌",
      "tags": "#墨尔本大学 #UMelb #澳洲留学 #CSC奖学金 #国家公派 #PhD申请 #留学干货"
    },
    "p2": {
      "title": "墨大 CSC 公派奖学金🎓",
      "body": "走国家公派路线读墨大 PhD，2026 年的名额正在开放，想申请的姐妹要抓紧了。\n\n墨尔本大学-CSC 联合奖学金的逻辑是:墨大出全额学费豁免，中国国家留学基金委那边出生活费和机票，两边合并下来综合资助最高约 $120,000 澳元（具体视学制长短，博士最多 3.5 年）。\n\n自费读墨大的研究生，光学费每年就要 $40,000–$55,000 澳元，走公派能绕开这一块，是读研最划算的组合之一。\n\n申请流程大概是三步:先联系院系导师拿到 Letter of Acceptance → 再通过 CSC 平台提交申报 → 最后墨大奖学金办公室确认。第一步最关键——没有导师同意书，后面全卡死。\n\n热门方向包括 CS / 生物医学 / 商学 / 教育研究 / 环境科学。每个院系名额独立分配，所以不同导师那边的竞争激烈程度差别很大。\n\n有在准备墨大 PhD 申请的姐妹评论区聊，我把我整理的导师邮件模板分享出来🙋",
      "tags": "#墨尔本大学 #UMelb #CSC奖学金 #国家公派 #PhD留学 #澳洲留学 #留学干货"
    },
    "p3": {
      "title": "墨大新 VC 来了 咋看👀",
      "body": "5 月 4 日墨尔本大学新任副校长 Prof Carolyn Evans 正式上任了，今天刷到这个消息就顺手整理一下对留学生来说意味着什么。\n\nEvans 教授之前是格里菲斯大学副校长，本人是宪法和人权法领域的学者，研究重点是宗教自由和法律多元主义。听起来很「人文」，但这个背景在多元文化学生群体里口碑不错——她之前在格里菲斯推过不少国际学生支持政策。\n\n现在最关心的问题大概是:政策会不会变？我目前判断是短期不会有大动作。墨大的国际生奖学金布局（MRS / CSC 联合奖学金 / Scientia 系列）已经铺开，新 VC 通常不会在头一年大幅调整既有招生策略。\n\nEvans 公开讲过想继续强化墨大的全球研究影响力和产业合作，这个方向和墨大过去几年的中澳科研合作延续是一致的。\n\n准备 2027 年申请的姐妹，按原计划推进就好，不用等新政策出来再动。有问题评论区聊。",
      "tags": "#墨尔本大学 #UMelb #澳洲留学 #留学生活 #大学新闻 #留学干货 #国际生"
    },
    "p4": {
      "title": "CSC 公派 vs 自费 墨大读 PhD💰",
      "body": "最近有几个姐妹问我：墨大 PhD 自费读值不值？我的答案是：先试试 CSC 公派这条路。\n\n背景：墨尔本大学-CSC 联合奖学金 2026 年度名额目前正在开放申请。走这条路的话，墨大出全额学费豁免（fee offset），CSC 出生活费 + 往返机票，综合资助最高约 $120,000 澳元（博士最多 3.5 年）。\n\n对比一下：自费读墨大研究生，光学费每年就 $40,000–$55,000 澳元，生活费另算。3.5 年下来总支出轻松 $200,000+ 澳元。\n\n公派的代价是什么？主要是需要先获得国内相关单位推荐（在职人员 / 高校在读硕士），且回国服务期要求。纯学术路线的同学，如果打算毕业留澳，可以先试 MRS 奖学金（全额 / 免学费），那条线无回国要求。\n\n两条路各有侧重，核心是先把导师这一关打通——没有墨大导师的 Letter of Acceptance，两条路都走不通。\n\n有姐妹在纠结的评论区扣 1，我可以分享一下我写导师邮件的结构。",
      "tags": "#墨尔本大学 #UMelb #CSC奖学金 #PhD留学 #澳洲留学 #留学干货 #奖学金攻略"
    },
    "p5": {
      "title": "墨大 5-08 两条｜一眼看完",
      "body": "墨大这周两条更新，挑重点说:\n\n01 / CSC 联合奖学金——2026 年名额开放，综合资助最高约 $120,000 澳元（墨大全免学费 + CSC 生活费机票）。申请先联系院系导师取 LoA，再到 CSC 平台申报。名额有限，5 月内要行动。主申方向：CS / 生物医学 / 商学 / 教育 / 环境科学。\n\n02 / 新副校长接棒——Prof Carolyn Evans 5 月 4 日正式上任。宪法与人权法背景，来自格里菲斯大学副校长岗，主张全球研究合作。短期内奖学金和招生政策延续，2027 年申请的姐妹按原计划推进即可。\n\n两条放在一起看，墨大这轮高层交接和奖学金布局方向对国际生是友好的。准备申请的姐妹趁这个窗口联系导师比较有利。\n\n评论区扣 1，我把我整理的申请材料清单分享出来🙌",
      "tags": "#墨尔本大学 #UMelb #澳洲留学 #CSC奖学金 #大学新闻 #留学干货 #PhD申请"
    }
  },
  "mp": {
    "title": "墨尔本大学 5 月 8 日：CSC 联合奖学金名额开放（最高约 $120,000）+ 新副校长 Prof Carolyn Evans 正式接任",
    "lead": "墨尔本大学 5 月 8 日两条更新同步释出。UMelb-CSC 联合奖学金 2026 年度名额正式开放申请，面向有意赴墨大攻读博士或研究型硕士的中国国家公派留学生，综合资助最高约 AUD $120,000（墨大全额学费豁免 + CSC 生活费 + 往返机票），名额有限须先取得院系导师书面同意。与此同时，Prof Carolyn Evans 于 5 月 4 日正式接任墨大副校长，来自格里菲斯大学副校长岗，宪法与人权法学者背景，战略方向延续 UMelb 全球研究合作与国际生支持路线，短期内招生及奖学金政策保持稳定。",
    "meta": { "readTime": "6 分钟" },
    "newsBodies": [
      {
        "h2": "UMelb-CSC 联合奖学金 2026 开放：最高约 $120,000 综合资助，名额有限先联导师",
        "paragraphs": [
          "墨尔本大学与中国国家留学基金委（CSC）联合奖学金 2026 年度名额目前正在接受申请，这是专门面向中国国家公派留学生的定向资助项目，适用于攻读墨大博士（PhD）或研究型硕士（Masters by Research）。联合奖学金采用「双方分担」机制：墨大一侧提供全额学费豁免（fee offset，免除国际生与本地生学费差额），CSC 一侧负责每月生活费补贴及往返机票，两部分合并下来综合资助额度最高约 AUD $120,000（视学制长短，PhD 最长资助 3.5 年，研究型硕士最长 2 年）。",
          "申请流程分三步：第一步，主动联系墨大目标院系导师并取得书面同意（Letter of Acceptance, LoA）——这是最关键的一步，没有导师 LoA，后续申请全部卡死；第二步，通过 CSC 官方平台提交申报材料，包括研究计划、语言成绩、学术背景等；第三步，墨大奖学金办公室审核并最终确认录取。热门申请方向包括计算机科学与软件工程、生物医学与健康科学、商学与管理（量化研究方向）、教育研究、环境与可持续发展科学。各院系名额独立分配，不同导师接收意愿差别较大，因此越早主动接触、拿到 LoA，成功率越高。",
          "对比参照：自费读墨大研究生，国际生年均学费在 AUD $40,000–$55,000 区间，3.5 年博士学制学费总支出即达 $140,000–$192,000，生活费另算，总成本轻松过 $250,000 澳元。走 CSC 公派路线，可完全绕开学费负担，是攻读墨大研究型学位性价比最高的资助组合。代价是需要符合 CSC 公派资格（在职人员 / 高校在读硕士 / 联培博士等类别），以及回国服务期要求。如不符合公派条件，可同步考虑墨大自身的 Melbourne Research Scholarship（MRS），全额学费豁免 + 年均 $39,500 生活费，10 月 31 日申请截止。"
        ],
        "sourceHtml": "来源：<a href=\"https://scholarships.unimelb.edu.au/awards/graduate-research-scholarships\">University of Melbourne · Graduate Research Scholarships</a>"
      },
      {
        "h2": "Prof Carolyn Evans 正式接任墨大副校长：宪法学者背景，延续国际化战略",
        "paragraphs": [
          "2026 年 5 月 4 日，Prof Carolyn Evans 正式出任墨尔本大学副校长（Vice-Chancellor），成为墨大历史上新一任学术与行政领导人。Evans 教授此前担任格里菲斯大学（Griffith University）副校长，在宪法法、人权法领域深耕多年，研究重点涵盖宗教自由、法律多元主义以及公民权利框架，在澳洲法学界拥有广泛影响力。她的个人学术背景以及在格里菲斯期间对多元文化学生群体支持项目的推动经历，被墨大国际学生社群视为正面信号。",
          "Evans 在公开表态中强调希望继续强化墨大在全球范围内的研究影响力与产业合作深度，并将扩大与重点合作国（包括中国、美国、英国、东南亚各国）的学术交流作为战略优先事项。这一方向与墨大近年来持续扩展的 CSC 联合奖学金、中澳科研合作项目（如材料科学、公共卫生、数字经济方向的联合实验室）高度吻合。在招生政策上，新任副校长接手的是已运作平稳的国际化招生框架，短期内不预期录取标准或奖学金数量发生重大调整。",
          "对于已在规划 2027 年入学的国际学生而言，此次高层交接属于平稳过渡，不影响现有申请和奖学金时间线。墨大 2026 年第二学期（7 月）入学的申请截止日已延至 5 月 31 日，有意年中入学的同学仍有窗口期；2027 年 2 月入学的主申季预计按惯例于 2026 年 8–10 月启动。走研究生路线的同学，当前最紧迫的任务是尽早联系目标导师，无论是 CSC 公派还是 MRS 奖学金路线，导师同意书都是优先条件。"
        ],
        "sourceHtml": "来源：<a href=\"https://www.unimelb.edu.au/newsroom\">University of Melbourne · Newsroom</a>"
      }
    ],
    "quickview": {
      "title": "📌 今日速览",
      "items": [
        "<strong>01 · UMelb-CSC 联合奖学金</strong>：2026 年度名额开放，最高约 $120,000 澳元综合资助（全免学费 + CSC 生活费机票）；须先取得院系导师 LoA，再通过 CSC 平台申报；名额有限，5 月内行动",
        "<strong>02 · 新副校长接棒</strong>：Prof Carolyn Evans 5 月 4 日正式上任；格里菲斯大学副校长出身，宪法与人权法学者；延续 UMelb 国际化合作与奖学金扩张方向，短期政策稳定"
      ]
    },
    "cta": {
      "big": "🎓 想每天收到澳洲大学的一手资讯？",
      "sub": "关注 JR Academy 公众号 · 回复「澳洲大学日报」订阅 · 官网 jiangren.com.au/blog · 历史日报全开放"
    }
  },
  "drafts": {
    "sections": [
      {
        "heading": "UMelb-CSC 联合奖学金｜公派读墨大最划算的路",
        "body": "准备申请墨大 PhD 的姐妹，今天这条一定要看。\n\n墨尔本大学-CSC 联合奖学金 2026 年度名额正在开放，面向中国国家公派留学生读博士或研究型硕士。资助结构是：墨大全额学费豁免 + CSC 出生活费和机票，综合下来最高约 $120,000 澳元。\n\n对比一下：自费读墨大研究生，学费每年 $40,000–$55,000，三年半博士下来学费就 $140,000–$190,000，加生活费总支出轻松过 $250,000。走公派路线能绕开全部学费，是性价比差距最大的选择之一。\n\n申请的关键在于第一步：联系院系导师取得书面同意（LoA）。没有这个，后面全卡死。热门方向是 CS / 生物医学 / 商学量化方向 / 教育研究 / 环境科学，各院系名额独立，不同导师接收意愿差别挺大的。\n\n公派条件是在职人员或在读硕士，满足条件的姐妹 5 月内联系导师比较有利。有问题的评论区聊，我把写导师邮件的结构分享出来🙌",
        "tags": ["#墨尔本大学", "#UMelb", "#CSC奖学金", "#国家公派", "#PhD留学", "#澳洲留学", "#奖学金攻略", "#留学干货"]
      }
    ],
    "sensitivityScan": [
      { "category": "绝对化",     "rule": "最 / 第一 / 唯一 / 100% / 首个",        "result": "未检出（「最划算」属口语化主观表达，非客观承诺；「最高约 $120,000」为条件范围表述）" },
      { "category": "教育承诺",   "rule": "包过 / 保录取 / 稳上 / 必中",           "result": "未检出" },
      { "category": "引流",       "rule": "加V / VX / 薇信 / 私信领取 / 关注公众号", "result": "未检出（xhsCopy 及 drafts 中仅含「评论区扣 1」合规互动话术）" },
      { "category": "封号红线",   "rule": "JR Academy / 匠人学院 / jiangren.com / 任何域名", "result": "未检出（xhsCopy + drafts 全部扫描；mp.cta 含 JR Academy 引流属公众号发稿页合法范围）" },
      { "category": "AI 味",      "rule": "首先其次最后 / 值得注意的是 / 综上所述",  "result": "未检出" },
      { "category": "医疗化妆品", "rule": "治疗 / 速效 / 纯天然",                  "result": "未检出" },
      { "category": "政治金融",   "rule": "保本 / 稳赚 / 年化 / 荐股",             "result": "未检出" }
    ]
  }
}
