{
  "schemaVersion": "1.0",
  "date": "2026-07-03",
  "school": "unsw",
  "summary": {
    "hookMain": "UNSW Sydney",
    "hookSub": "今日两件 大事",
    "hookSubHighlight": "大事",
    "subLines": [
      "🤖 软体机器人心脏研究突破",
      "💰 薪日超级年金改革正式生效",
      "留学生必须掌握的澳洲就业新规"
    ],
    "previewCards": [
      { "num": "01", "title": "软体机器人心脏", "data": "模拟真实心脏瓣膜病变" },
      { "num": "02", "title": "薪日超级年金", "data": "7 个工作日内必须缴纳" }
    ]
  },
  "news": [
    {
      "idx": "01",
      "category": "医学科研",
      "h2Main": "软体机器人心脏",
      "h2Sub": "模拟心脏病变 减少动物实验",
      "h2Highlight": "软体机器人",
      "lead": "UNSW 生物医学工程学院研究团队研发出<b>全合成软体机器人心脏</b>，可精准复现左心室运动及瓣膜病变，成果同步发表于《自然通讯》与《先进科学》两大顶刊。",
      "bullets": [
        { "k": "研究亮点", "v": "全合成结构还原左心室运动、人工瓣膜、乳头肌及腱索" },
        { "k": "临床价值", "v": "可模拟瓣膜泄漏、血液倒流等真实病变场景" },
        { "k": "减少实验", "v": "大幅降低心脏研究对动物实验的依赖" },
        { "k": "个体化测试", "v": "支持为特定患者定制测试心脏救治装置" },
        { "k": "发表期刊", "v": "Nature Communications + Advanced Science（2026-07）" }
      ],
      "source": "UNSW Newsroom · 2026-07-01",
      "sourceUrl": "https://www.unsw.edu.au/newsroom/news/2026/07/Soft_robotic_heart_study_diseases_and_life-saving_devices"
    },
    {
      "idx": "02",
      "category": "就业政策",
      "h2Main": "薪日超级年金",
      "h2Sub": "7 日缴付 留学生也受益",
      "h2Highlight": "薪日超级年金",
      "lead": "澳洲<b>薪日超级年金（Payday Super）</b>于 2026 年 7 月 1 日正式实施，雇主须在发薪后 <b>7 个工作日内</b>完成养老金缴纳，替代此前的季度缴付制度。",
      "bullets": [
        { "k": "生效日期", "v": "2026 年 7 月 1 日起正式施行" },
        { "k": "缴纳期限", "v": "每次发薪后 7 个工作日内须完成缴纳（原为季度）" },
        { "k": "SG 比率", "v": "雇主强制缴费比率维持 12% 不变" },
        { "k": "退休收益", "v": "测算：25 岁中位收入者退休时可多获约 $6,000（+1.5%）" },
        { "k": "权益保障", "v": "员工可更快发现欠缴情况，维权窗口大幅缩短" }
      ],
      "source": "UNSW Newsroom · 2026-07-01",
      "sourceUrl": "https://www.unsw.edu.au/newsroom/news/2026/07/payday-super-what-does-it-mean-for-your-retirement-savings"
    }
  ],
  "quickview": {
    "titleMain": "今日速览",
    "titleHighlight": "一眼看完",
    "sub": "UNSW 今日两条重磅资讯",
    "items": [
      {
        "n": "01",
        "title": "软体机器人心脏",
        "body": "UNSW 团队研发全合成软体机器人心脏，可模拟瓣膜病变，发表于 Nature Communications + Advanced Science，助力个体化心脏装置研发。"
      },
      {
        "n": "02",
        "title": "薪日超级年金",
        "body": "2026-07-01 起澳洲雇主须在 7 个工作日内完成养老金缴纳，中位收入者退休可多获约 $6,000，留学毕业生打工权益更有保障。"
      }
    ],
    "cta": {
      "big": "关注每日大学日报",
      "sub": "10 所澳洲大学 · 每天 3 校 · 奖学金 + 科研 + 招生一手同步",
      "badge": "07 / 03"
    }
  },
  "xhsCopy": {
    "p1": {
      "title": "UNSW 今日大事速递",
      "body": "🏥 软体机器人心脏研究突破\n💰 薪日超级年金今日生效\n\nUNSW 今天有两条重磅消息值得关注！一条关乎医学科研突破，一条关乎你的退休存款权益～\n\n👇 左右滑动看详情",
      "tags": "#UNSW #新南威尔士大学 #澳洲留学 #澳洲新闻 #大学资讯"
    },
    "p2": {
      "title": "软体机器人心脏 顶刊双发",
      "body": "🤖 UNSW 生物医学团队研发出全合成软体机器人心脏\n\n✅ 精准复现左心室运动\n✅ 内置人工瓣膜 + 乳头肌 + 腱索\n✅ 可模拟真实心脏瓣膜病变\n✅ 支持患者个体化装置测试\n✅ 减少动物实验依赖\n\n成果同时发表于《自然通讯》和《先进科学》两大顶刊 🔬\n\n来源：UNSW Newsroom · 2026-07-01",
      "tags": "#UNSW #医学科研 #机器人心脏 #生物医学 #澳洲大学研究"
    },
    "p3": {
      "title": "薪日超级年金 今起实施",
      "body": "💰 澳洲薪日超级年金（Payday Super）2026-07-01 正式上线！\n\n🗓 雇主每次发薪后 7 个工作日内必须缴纳养老金\n📈 SG 比率维持 12% 不变\n💵 测算：25 岁中位收入者退休可多获约 $6,000\n🔍 员工更快发现欠缴，维权更容易\n\n打工族 / 留学生兼职的你，记得关注自己的 super 账户！\n\n来源：UNSW Newsroom · 2026-07-01",
      "tags": "#澳洲超级年金 #薪日缴付 #PaydaySuper #留学生打工 #澳洲就业"
    },
    "p4": {
      "title": "UNSW 科研 + 政策双亮点",
      "body": "今天 UNSW 两条新闻都很有料 👇\n\n🔬 软体机器人心脏：全球首个全合成模型，模拟心脏病变，减少动物实验，顶刊双发\n\n💼 薪日超级年金：发薪 7 天内必须入账，退休收益更有保障，拖欠更易被发现\n\n一条关乎医学未来，一条关乎你的钱包 💪",
      "tags": "#UNSW #新南威尔士大学 #澳洲留学 #澳洲政策 #医学研究"
    },
    "p5": {
      "title": "UNSW 今日速览两则",
      "body": "📋 UNSW 今日速览\n\n01｜软体机器人心脏\n全合成结构模拟瓣膜病变，顶刊双发，支持个体化测试\n\n02｜薪日超级年金\n7 日缴付正式实施，中位收入者退休多获约 $6,000\n\n👆 两条新闻都值得关注！",
      "tags": "#UNSW #新南威尔士大学 #澳洲留学 #澳洲大学 #每日大学新闻"
    }
  },
  "mp": {
    "title": "UNSW 科研突破 + 薪日超级年金今日生效",
    "lead": "新南威尔士大学今日（2026-07-01）带来两条重磅资讯：全球领先的软体机器人心脏研究成果同步登上国际顶刊，澳洲薪日超级年金制度同步正式落地，留学生和打工族的退休权益保障再升级。",
    "meta": { "readTime": "约 3 分钟" },
    "newsBodies": [
      {
        "h2": "软体机器人心脏：模拟心脏病变的科研突破",
        "paragraphs": [
          "UNSW 生物医学工程学院 Thanh Nho Do 副教授团队研发出全球领先的全合成软体机器人心脏，能够精准复现左心室的运动模式，内置人工瓣膜、乳头肌及腱索等关键结构，可模拟现实中的瓣膜泄漏和血液倒流等病变场景。",
          "这一成果的重要意义在于：研究人员无需依赖动物实验或真实捐赠心脏，即可测试新型心脏救治装置的效果，并为特定患者提供个体化的装置测试方案，为未来心脏医疗器械的开发提供了全新的实验平台。",
          "相关研究成果同步发表于《自然通讯》（Nature Communications）和《先进科学》（Advanced Science）两大国际顶刊，标志着 UNSW 在医学机器人领域的研究再攀新高。"
        ],
        "sourceHtml": "来源：<a href=\"https://www.unsw.edu.au/newsroom/news/2026/07/Soft_robotic_heart_study_diseases_and_life-saving_devices\">UNSW Newsroom · 2026-07-01</a>"
      },
      {
        "h2": "薪日超级年金：你的退休权益升级了",
        "paragraphs": [
          "澳洲薪日超级年金（Payday Super）制度于 2026 年 7 月 1 日正式生效，这是澳洲养老金制度数十年来最重要的改革之一。新规要求雇主在每次向员工发薪后的 7 个工作日内完成养老金缴纳，彻底告别过去按季度缴付的惯例。",
          "UNSW 研究测算显示，以 25 岁中位收入劳动者为例，新制度下其退休时可累计多获得约 6,000 澳元养老金，较旧制度提升约 1.5%。此外，缴纳频率的提升也让员工能更及时发现雇主欠缴行为，维权窗口大幅缩短。",
          "对于在澳留学并兼职打工的学生而言，了解薪日超级年金制度尤为重要。若发现雇主未按时缴纳，可向澳洲税务局（ATO）举报。雇主强制缴费比率（SG）维持 12% 不变。"
        ],
        "sourceHtml": "来源：<a href=\"https://www.unsw.edu.au/newsroom/news/2026/07/payday-super-what-does-it-mean-for-your-retirement-savings\">UNSW Newsroom · 2026-07-01</a>"
      }
    ],
    "quickview": {
      "title": "今日速览",
      "items": [
        "软体机器人心脏：UNSW 全合成模型模拟瓣膜病变，顶刊双发，支持个体化心脏装置测试",
        "薪日超级年金：2026-07-01 起 7 日内缴付，中位收入者退休多获约 $6,000"
      ]
    },
    "cta": {
      "big": "关注每日大学日报",
      "sub": "10 所澳洲大学 · 每天 3 校 · 奖学金 + 科研 + 招生一手同步"
    }
  },
  "drafts": {
    "sections": [
      {
        "heading": "草稿一：软体机器人心脏研究突破",
        "body": "UNSW 搞了个「软体机器人心脏」🤖心\n\n不是科幻小说，是真实发表在 Nature Communications 和 Advanced Science 的研究成果——\n\n全合成材料还原了左心室的运动，内置人工瓣膜、乳头肌和腱索，甚至能模拟瓣膜泄漏、血液倒流这些真实病变场景。\n\n最重要的是：有了它，研究心脏病不用再大量依赖动物实验了，还能为特定患者量身定制心脏装置的测试方案。\n\n澳洲大学的医学科研水平真的不是吹出来的，这种顶刊双发的成果放在全球都是前排 🏆\n\n#UNSW #新南威尔士大学 #医学科研 #机器人心脏 #澳洲大学 #生物医学 #科研突破 #澳洲留学",
        "tags": ["#UNSW", "#新南威尔士大学", "#医学科研", "#机器人心脏", "#澳洲大学", "#生物医学", "#科研突破", "#澳洲留学"]
      },
      {
        "heading": "草稿二：薪日超级年金留学生版解读",
        "body": "在澳洲打工的同学注意了！\n\n2026 年 7 月 1 日起，澳洲「薪日超级年金」正式生效 💰\n\n以前雇主是每季度才缴一次养老金（super）——\n现在改成：**每次发工资后 7 个工作日内必须缴**\n\n这意味着什么？\n✅ 你能更快发现雇主有没有欠缴\n✅ 退休时到手钱更多（测算显示 25 岁起算能多 ~$6,000）\n✅ 维权更容易——拖欠窗口从 3 个月缩到 7 天\n\nSG 比率还是 12%，没变。\n\n小提醒：发薪后留意一下 super 有没有入账，发现问题及时联系 ATO。\n\n#澳洲超级年金 #PaydaySuper #薪日缴付 #留学生打工 #澳洲生活 #打工攻略 #UNSW #澳洲留学",
        "tags": ["#澳洲超级年金", "#PaydaySuper", "#薪日缴付", "#留学生打工", "#澳洲生活", "#打工攻略", "#UNSW", "#澳洲留学"]
      }
    ],
    "sensitivityScan": [
      { "category": "绝对化", "rule": "最 / 第一 / 唯一", "result": "未检出" },
      { "category": "教育承诺", "rule": "保录取 / 包过 / 保过", "result": "未检出" },
      { "category": "引流", "rule": "加V / VX / 薇信 / 加微信", "result": "未检出" },
      { "category": "品牌词", "rule": "JR Academy / 匠人学院 / jiangren.com", "result": "未检出" },
      { "category": "夸大收益", "rule": "稳赚 / 必涨 / 零风险", "result": "未检出" }
    ]
  }
}
